{
  "export_name": "analysis_workbook",
  "snapshot_date": "2026-05-28",
  "schema_version": "1.0.0",
  "metric_version": "metric-v1",
  "run_id": "run-20260530T083218Z",
  "template_version": "",
  "freeze_id": "",
  "source_tables": [
    "analysis_tables"
  ],
  "row_count": 10,
  "generated_at": "2026-05-30T16:32:30",
  "consumer": "excel_workbook.unified-fact",
  "output_path": "/private/tmp/oae_release_contract_fix_20260530/全量分析/analysis_workbook_unified-fact_latest_2026-05-28.xlsx"
}