{
  "export_name": "feishu_table_latest",
  "snapshot_date": "2026-03-22",
  "schema_version": "1.0.0",
  "metric_version": "metric-v1",
  "run_id": "run-20260323T090307Z",
  "template_version": "excel-tsv-v1",
  "freeze_id": "provisional-daily-report-20260323-override",
  "source_tables": [
    "daily_performance_snapshot",
    "compensation_ledger",
    "analysis_snapshot",
    "fact_attribution"
  ],
  "row_count": 12,
  "generated_at": "2026-03-23T17:03:25",
  "consumer": "excel_template_v1",
  "output_path": "/Users/ahs/Desktop/Operations Analytics Engine/output/sql_reports/feishu_table_latest_2026-03-22.tsv"
}