{
  "export_name": "analysis_anomaly_report",
  "snapshot_date": "2026-03-12",
  "schema_version": "1.0.0",
  "metric_version": "metric-v1",
  "run_id": "full-chain-test-raw",
  "template_version": "",
  "freeze_id": "",
  "source_tables": [
    "raw_time_anomaly"
  ],
  "row_count": 4,
  "generated_at": "2026-03-15T12:46:43",
  "consumer": "excel_workbook.raw-evidence",
  "output_path": "/Users/ahs/Desktop/Operations Analytics Engine/全量分析_round10_raw_test/analysis_anomaly_report_raw-evidence_latest_2026-03-12.xlsx"
}