{
  "export_name": "analysis_workbook",
  "snapshot_date": "2026-03-22",
  "schema_version": "1.0.0",
  "metric_version": "metric-v1",
  "run_id": "run-20260323T090307Z",
  "template_version": "",
  "freeze_id": "",
  "source_tables": [
    "analysis_tables"
  ],
  "row_count": 10,
  "generated_at": "2026-03-23T17:03:24",
  "consumer": "excel_workbook.unified-fact",
  "output_path": "/Users/ahs/Desktop/Operations Analytics Engine/全量分析/analysis_workbook_unified-fact_latest_2026-03-22.xlsx"
}