{
  "export_name": "raw_anomaly_report",
  "snapshot_date": "2026-03-12",
  "schema_version": "1.0.0",
  "metric_version": "metric-v1",
  "run_id": "round4-raw-main",
  "template_version": "",
  "freeze_id": "",
  "source_tables": [
    "raw_time_anomaly"
  ],
  "row_count": 4,
  "generated_at": "2026-03-13T22:24:30",
  "consumer": "excel_workbook",
  "output_path": "/Users/ahs/Desktop/Operations Analytics Engine/全量分析_round4_raw/time_chain_anomaly_report.xlsx"
}