{
  "export_name": "analysis_snapshot",
  "snapshot_date": "2026-03-12",
  "schema_version": "1.0.0",
  "metric_version": "metric-v1",
  "run_id": "runtime-check-raw",
  "template_version": "",
  "freeze_id": "",
  "source_tables": [
    "analysis_snapshot"
  ],
  "row_count": 5906,
  "generated_at": "2026-03-15T12:12:29",
  "consumer": "analysis-snapshot.raw-evidence",
  "output_path": "/Users/ahs/Desktop/Operations Analytics Engine/artifacts/snapshots/round10_raw_runtime_check/analysis_snapshot_raw-evidence_latest_2026-03-12.csv"
}