{
  "export_name": "feishu_table_latest",
  "snapshot_date": "2026-03-12",
  "schema_version": "1.0.0",
  "metric_version": "metric-v1",
  "run_id": "round1-test",
  "template_version": "excel-tsv-v1",
  "freeze_id": "provisional-round1",
  "source_tables": [
    "daily_performance_snapshot",
    "compensation_ledger",
    "analysis_snapshot",
    "fact_attribution"
  ],
  "row_count": 12,
  "generated_at": "2026-03-13T20:38:37",
  "consumer": "excel_template_v1",
  "output_path": "/Users/ahs/Desktop/Operations Analytics Engine/output/round1_reports/feishu_table_latest_2026-03-12.tsv"
}