{
  "export_name": "analysis_workbook",
  "snapshot_date": "2026-03-12",
  "schema_version": "1.0.0",
  "metric_version": "metric-v1",
  "run_id": "runtime-check-raw",
  "template_version": "",
  "freeze_id": "",
  "source_tables": [
    "raw_evidence_tables"
  ],
  "row_count": 27,
  "generated_at": "2026-03-15T12:12:29",
  "consumer": "excel_workbook.raw-evidence",
  "output_path": "/Users/ahs/Desktop/Operations Analytics Engine/全量分析_round10_raw_runtime_check/analysis_workbook_raw-evidence_latest_2026-03-12.xlsx"
}